Issue ID,Issue Title,GitHub Link,Issue Details
621,unexpected output from python 3 function,https://github.com/openfaas/faas/issues/621,"{'description': '<!--- Provide a general summary of the issue in the Title above -->\r\nI\'ve deployed the following function to OpenFaaS via Docker Swarm and faas-cli: https://github.com/blaskovicz/rmb-to-usd.  After using it for a few days on and off via [my website](https://www.carlyzach.com/functions/rmb-to-usd), I noticed that it was no longer responding correctly.\r\n \r\nAfter looking at the service in `docker service ps` it seemed to be up; upon scaling it down to 0 and then back up to 1, it started responding with the correct output. I was wondering if you could help provide any insight into what went wrong? \r\n\r\n## Expected Behaviour\r\n<!--- If you\'re describing a bug, tell us what should happen -->\r\n<!--- If you\'re suggesting a change/improvement, tell us how it should work -->\r\nThe function should respond with a JSON body:\r\n```sh\r\n$ echo ""hi"" | faas-cli invoke rmb-to-usd -                                                                                                                   \r\n{""id"": ""unprocessable_entity"", ""message"": ""the request body was malformed""}\r\n```\r\n\r\n## Current Behaviour\r\n<!--- If describing a bug, tell us what happens instead of the expected behavior -->\r\n<!--- If suggesting a change/improvement, explain the difference from current behavior -->\r\n\r\nFrom the `faas-cli`, I receive something strange, statistics output, perhaps?\r\n```sh\r\n$ echo ""hi"" | faas-cli invoke rmb-to-usd                                                                                                                        \r\n        1         1         3\r\n```\r\n\r\nFrom a POST to the function via the gateway, I got a similar response body:\r\n```\r\n        0         1        24\r\n```\r\n\r\n## Possible Solution\r\n<!--- Not obligatory, but suggest a fix/reason for the bug, -->\r\n<!--- or ideas how to implement the addition or change -->\r\nAfter restarting the function (`docker service scale rmb-to-usd=0 && docker service scale rmb-to-usd=1`), the function again began to service requests correctly.\r\n\r\n## Your Environment\r\n<!--- Include as many relevant details about the environment you experienced the bug in -->\r\n* Docker version `docker version` (e.g. Docker 17.0.05 ):\r\n```sh\r\n$ docker version\r\nClient:\r\n Version:      17.09.0-ce\r\n API version:  1.32\r\n Go version:   go1.8.3\r\n Git commit:   afdb6d4\r\n Built:        Tue Sep 26 22:42:18 2017\r\n OS/Arch:      linux/amd64\r\n\r\nServer:\r\n Version:      17.09.0-ce\r\n API version:  1.32 (minimum version 1.12)\r\n Go version:   go1.8.3\r\n Git commit:   afdb6d4\r\n Built:        Tue Sep 26 22:40:56 2017\r\n OS/Arch:      linux/amd64\r\n Experimental: false\r\n```\r\n\r\n* Are you using Docker Swarm or Kubernetes (FaaS-netes)?\r\nDocker Swarm.\r\n\r\n* Operating System and version (e.g. Linux, Windows, MacOS):\r\nUbuntu 16.04 LTS\r\n\r\n* Link to your project or a code example to reproduce issue:\r\n   * Code: https://github.com/blaskovicz/rmb-to-usd\r\n   * Site: https://www.carlyzach.com/functions/rmb-to-usd\r\n\r\n* Please also follow the [troubleshooting guide](https://github.com/openfaas/faas/blob/master/guide/troubleshooting.md) and paste in any other diagnostic information you have:\r\n\r\nState before function restart:\r\n```sh\r\n$ docker service ps rmb-to-usd \r\nID                  NAME                IMAGE                              NODE                DESIRED STATE       CURRENT STATE         ERROR                              PORTS\r\nu2cn200qd014        rmb-to-usd.1        127.0.0.1:5000/rmb-to-usd:latest   z      Running             Running 3 days ago                                       \r\naxrzewhs2dip         \\_ rmb-to-usd.1    127.0.0.1:5000/rmb-to-usd:latest   z      Shutdown            Failed 3 days ago     ""starting container failed: No…""   \r\npety5payl7l0         \\_ rmb-to-usd.1    127.0.0.1:5000/rmb-to-usd:latest   z      Shutdown            Failed 3 days ago     ""No such container: rmb-to-usd…""   \r\n9muw046ek71y         \\_ rmb-to-usd.1    127.0.0.1:5000/rmb-to-usd:latest   z      Shutdown            Failed 3 days ago     ""No such container: rmb-to-usd…""   \r\n4n09olyall8m         \\_ rmb-to-usd.1    127.0.0.1:5000/rmb-to-usd:latest   z      Shutdown            Shutdown 3 days ago                                      \r\niw6kv16pb137         \\_ rmb-to-usd.1    127.0.0.1:5000/rmb-to-usd:latest   z      Shutdown            Shutdown 3 days ago                                      \r\n```\r\n', 'comments': [""This is something I definitely haven't seen/experienced.  The unexpected output looks like the output from the `func_wordcount` sample function.\r\n\r\nWhat happened 3 days ago? What are those failed state error messages alluding to?\r\n\r\nDo the gateway logs still hold the info about the requests that returned the unexpected output?\r\n\r\nIs this a isolated occurrence or are you able to reproduce it?\r\n"", 'Derek set title: Unexpected output from Python 3 function ', '3 days ago I did reboot the underlying system, but my other functions, [playground-golang](https://github.com/blaskovicz/playground-golang) and `func_markdown` rebooted and had no issues:\r\n\r\n```sh\r\n$ uptime\r\n 10:49:05 up 3 days, 12:39,  2 users,  load average: 1.17, 1.03, 0.90\r\n```\r\n\r\n```\r\n$ zgrep  rmb-to-usd /var/log/syslog*\r\n/var/log/syslog:Apr  1 09:42:43 z dockerd[1786]: time=""2018-04-01T09:42:43.268514345-04:00"" level=error msg=""logs call failed"" error=""failed getting container logs: No such container: rmb-to-usd.1.axrzewhs2dipfzzjqj64tm85i"" module=""node/agent/taskmanager"" node.id=75e271bvg2t57wusmqn0groyo\r\n/var/log/syslog:Apr  1 09:44:24 z dockerd[1786]: time=""2018-04-01T09:44:24.068673333-04:00"" level=warning msg=""failed to deactivate service binding for container rmb-to-usd.1.4n09olyall8mdkjt57osqz44t"" error=""No such container: rmb-to-usd.1.4n09olyall8mdkjt57osqz44t"" module=""node/agent"" node.id=75e271bvg2t57wusmqn0groyo\r\n/var/log/syslog:Apr  1 09:44:24 z dockerd[1786]: time=""2018-04-01T09:44:24.069180207-04:00"" level=warning msg=""failed to deactivate service binding for container rmb-to-usd.1.9muw046ek71y9lrur75o5cwxb"" error=""No such container: rmb-to-usd.1.9muw046ek71y9lrur75o5cwxb"" module=""node/agent"" node.id=75e271bvg2t57wusmqn0groyo\r\n/var/log/syslog:Apr  1 09:44:24 z dockerd[1786]: time=""2018-04-01T09:44:24.069409689-04:00"" level=warning msg=""failed to deactivate service binding for container rmb-to-usd.1.axrzewhs2dipfzzjqj64tm85i"" error=""No such container: rmb-to-usd.1.axrzewhs2dipfzzjqj64tm85i"" module=""node/agent"" node.id=75e271bvg2t57wusmqn0groyo\r\n/var/log/syslog:Apr  1 09:44:24 z dockerd[1786]: time=""2018-04-01T09:44:24.069590364-04:00"" level=warning msg=""failed to deactivate service binding for container rmb-to-usd.1.iw6kv16pb137gthuysb3r5mh3"" error=""No such container: rmb-to-usd.1.iw6kv16pb137gthuysb3r5mh3"" module=""node/agent"" node.id=75e271bvg2t57wusmqn0groyo\r\n/var/log/syslog:Apr  1 09:44:24 z dockerd[1786]: time=""2018-04-01T09:44:24.069815663-04:00"" level=warning msg=""failed to deactivate service binding for container rmb-to-usd.1.pety5payl7l044vvvfrsxz02o"" error=""No such container: rmb-to-usd.1.pety5payl7l044vvvfrsxz02o"" module=""node/agent"" node.id=75e271bvg2t57wusmqn0groyo\r\n/var/log/syslog.4.gz:Mar 28 21:43:15 z dockerd[1580]: time=""2018-03-28T21:43:15.056693057-04:00"" level=error msg=""fatal task error"" error=""No such container: rmb-to-usd.1.9muw046ek71y9lrur75o5cwxb"" module=""node/agent/taskmanager"" node.id=75e271bvg2t57wusmqn0groyo service.id=chk4e56wfhi2zq7rmgumbryc7 task.id=9muw046ek71y9lrur75o5cwxb\r\n/var/log/syslog.4.gz:Mar 28 22:10:15 z dockerd[1786]: time=""2018-03-28T22:10:15.038716739-04:00"" level=error msg=""fatal task error"" error=""No such container: rmb-to-usd.1.pety5payl7l044vvvfrsxz02o"" module=""node/agent/taskmanager"" node.id=75e271bvg2t57wusmqn0groyo service.id=chk4e56wfhi2zq7rmgumbryc7 task.id=pety5payl7l044vvvfrsxz02o\r\n/var/log/syslog.4.gz:Mar 28 22:10:20 z dockerd[1786]: time=""2018-03-28T22:10:20.679675495-04:00"" level=warning msg=""failed to deactivate service binding for container rmb-to-usd.1.1w21v41dk3pu6agto8nmkvkmf"" error=""No such container: rmb-to-usd.1.1w21v41dk3pu6agto8nmkvkmf"" module=""node/agent"" node.id=75e271bvg2t57wusmqn0groyo\r\n/var/log/syslog.4.gz:Mar 28 22:10:31 z dockerd[1786]: time=""2018-03-28T22:10:31.852767657-04:00"" level=warning msg=""failed to deactivate service binding for container rmb-to-usd.1.2ekqeqj35a8577s4jqx2fk5u5"" error=""No such container: rmb-to-usd.1.2ekqeqj35a8577s4jqx2fk5u5"" module=""node/agent"" node.id=75e271bvg2t57wusmqn0groyo\r\n```\r\n\r\nThe gateway logs don\'t show anything useful, they seem to be the same for yesterday (non-working) and today (working after restart):\r\n```sh\r\n$  docker service logs func_gateway\r\nfunc_gateway.1.kk78rwblgk3z@z    | 2018/03/31 21:29:37 > Forwarding [POST] to /function/rmb-to-usd\r\nfunc_gateway.1.kk78rwblgk3z@z    | 2018/03/31 21:29:37 GetHeaderCode 200\r\nfunc_gateway.1.kk78rwblgk3z@z    | 2018/03/31 21:29:37 < [http://faas-swarm:8080/function/rmb-to-usd] - 200 took 0.018241 seconds\r\nfunc_gateway.1.kk78rwblgk3z@z    | 2018/04/01 02:29:06 > Forwarding [POST] to /function/rmb-to-usd\r\nfunc_gateway.1.kk78rwblgk3z@z    | 2018/04/01 02:29:06 GetHeaderCode 200\r\nfunc_gateway.1.kk78rwblgk3z@z    | 2018/04/01 02:29:06 < [http://faas-swarm:8080/function/rmb-to-usd] - 200 took 0.004942 seconds\r\n```', 'Thanks for the further info.\r\n\r\nDo you know if the unexpected output was extant for the full period from 3 days ago until the `service scale` activity today?  Or was the function confirmed as working following your reboot and switched to unexpected output some time later?  If the latter what time would that be?\r\n\r\nMy suspicion (and its no more than that currently) is that this could relate to a Docker feature which has been fixed in later versions.  Would pulling Docker up to something more recent be a possibility?', ""@rgee0 I didn't test the function immediately following the host reboot, but I would assume it was broken after that time up until I `docker service scale`d.\r\n\r\nI could try updating docker. Seeing as 17.09 isn't that old, what issue do you think is causing this?\r\n\r\nhttps://docs.docker.com/release-notes/docker-ce/#17091-ce-2017-12-07"", ""Whats concerning me is that your invocation seems to be hitting a totally separate function.  This could be that the wordcount image has been tagged as your rmb image (unlikely and wouldn't be fixed by a scale operation), or that the service definitions contain stale information, or something else that I'm yet to consider/uncover.\r\n\r\nAlthough this is the first time I've seen this reported on OpenFaaS, I have seen issues with Docker, which are said to be fixed in 17.12 and greater, where the services would have issues with IP addresses.  My supposition at this stage is that when the rmb service came back up following the reboot it was provided an IP address which was being used by wordcount, or that the rmb service information was stale and wordcount was allocated the IP address that was in the stale rmb information.  \r\n\r\nOf course its difficult to fully diagnose & test the cause, and test the fix via github issues so there's a bit of a leap here.  We could try rebooting your host again to see if the issue can be reproduced - this could possibly impact a different set of services that we could then interrogate with `service inspect`.  Alternatively we might fail to reproduce.\r\n\r\nOut of interest, are those invoke commands in the initial comment copy and pasted? How are you hitting the gateway on a bespoke port without supplying `-g`?  Also, to save me making further assumptions could we get a view of your `docker service ls` output, please?"", ""My guess is that this is either an issue with the Docker version you're using or that your Docker registry container wasn't started when you rebooted the machine.\r\n\r\nDid you run your local registry with a --restart=always flag?\r\n\r\nI can see from the output from docker service ps that you have had some issues with your local registry.\r\n\r\nI'd be inclined to close this issue - it doesn't appear to be reproducible, but if you do come up with clear steps for reproducing the problem let us know and we can look into it."", 'I can see it being related to the registry being flaky. Earlier today I noticed it was in a bad state and had to scale it to 0 then back up to 1.\r\n\r\n```\r\n$ docker service inspect --pretty registry                                                                                                         \r\n\r\nID:             u45blt5vyvhke12qvppt0qob2\r\nName:           registry\r\nService Mode:   Replicated\r\n Replicas:      1\r\nPlacement:\r\nUpdateConfig:\r\n Parallelism:   1\r\n On failure:    pause\r\n Monitoring Period: 5s\r\n Max failure ratio: 0\r\n Update order:      stop-first\r\nRollbackConfig:\r\n Parallelism:   1\r\n On failure:    pause\r\n Monitoring Period: 5s\r\n Max failure ratio: 0\r\n Rollback order:    stop-first\r\nContainerSpec:\r\n Image:         registry:2@sha256:672d519d7fd7bbc7a448d17956ebeefe225d5eb27509d8dc5ce67ecb4a0bce54\r\nResources:\r\nEndpoint Mode:  vip\r\nPorts:\r\n PublishedPort = 5000\r\n  Protocol = tcp\r\n  TargetPort = 5000\r\n  PublishMode = ingress\r\n```\r\n\r\nI think when I originally deployed openfaas, I changed the default published port:\r\n\r\n```\r\n--- a/docker-compose.yml\r\n+++ b/docker-compose.yml\r\n@@ -2,7 +2,7 @@ version: ""3.3""\r\n services:\r\n     gateway:\r\n         ports:\r\n-            - 8080:8080\r\n+            - 8082:8080\r\n```\r\n\r\nService list:\r\n```\r\n$ docker service ls\r\n9u4pxjv4m6cl        func_alertmanager                    replicated          1/1                 prom/alertmanager:v0.15.0-rc.0                     \r\nqavk0a348lvn        func_base64                          replicated          1/1                 functions/alpine:latest                            \r\n6iru17vgguf0        func_echoit                          replicated          1/1                 functions/alpine:latest                            \r\n6lfj66ylje8l        func_faas-swarm                      replicated          1/1                 functions/faas-swarm:0.2.2                         \r\nwf9zw1g9lukb        func_gateway                         replicated          1/1                 functions/gateway:0.7.3                            *:8082->8080/tcp\r\nhen7ixpduf7l        func_hubstats                        replicated          1/1                 functions/hubstats:latest                          \r\nxby7mtg5i0qi        func_markdown                        replicated          1/1                 functions/markdown-render:latest                   \r\nm3judmv4evz2        func_nats                            replicated          1/1                 nats-streaming:0.6.0                               \r\nj1s8klbyfv8c        func_nodeinfo                        replicated          1/1                 functions/nodeinfo:latest                          \r\njoujjdk2awoz        func_prometheus                      replicated          1/1                 prom/prometheus:v2.2.0                             *:8083->9090/tcp\r\nviq7fr588o40        func_queue-worker                    replicated          1/1                 functions/queue-worker:0.4                         \r\ni5eadsxd7xqn        func_wordcount                       replicated          1/1                 functions/alpine:latest                            \r\ngunbgjl4qfp6        playground-golang                    replicated          1/1                 127.0.0.1:5000/playground-golang:latest            \r\nu45blt5vyvhk        registry                             replicated          1/1                 registry:2                                         *:5000->5000/tcp\r\n```\r\n', 'I’m going to close the issue. Please comment again if needed. ']}"
633,issues with function chaining following function director pattern,https://github.com/openfaas/faas/issues/633,"{'description': ""## Current Behaviour\r\nI am trying out OpenFaas and having issues chaining/composing functions following the [function director pattern](https://github.com/openfaas/faas/blob/master/guide/chaining_functions.md#function-director-pattern). However, I can pipe output of one function to another using `curl`.\r\n\r\nI am trying to accomplish the following - \r\n* `world` function returns the text 'world'\r\n* `hello` function take text as input and return 'hello _text_' as output\r\n* `helloworld` chains the two functions above by taking the output of `world` as input for `hello` and outputs 'Hello world'\r\n\r\nFunction piping works from the command line by piping the following commands - \r\n```bash\r\n$ curl -s http://127.0.0.1:8080/function/world | curl -sX POST http://127.0.0.1:8080/function/hello --data @-\r\nHello world\r\n```\r\n\r\nHowever, chaining the functions following the [function director pattern](https://github.com/openfaas/faas/blob/master/guide/chaining_functions.md#function-director-pattern) does not seem to work. The function seems to _hang_ and CPU utilization of docker goes up drastically.\r\n\r\nCan someone please suggest what I may be doing wrong?\r\n\r\n## Your Environment\r\n<!--- Include as many relevant details about the environment you experienced the bug in -->\r\n* Docker version `docker version` (e.g. Docker 17.0.05 ):\r\nDocker version 18.03.0-ce, build 0520e24\r\n* Are you using Docker Swarm or Kubernetes (FaaS-netes)?\r\nSwarm\r\n* Operating System and version (e.g. Linux, Windows, MacOS):\r\nmacOS 10.12.6\r\n* Link to your project or a code example to reproduce issue:\r\nhttps://github.com/satie/helloworld-faas\r\n"", 'comments': ['Hi I took a quick look at the code and noticed that it looked quite complicated. I wonder if you could try using the request.js npm module in your example?\r\n\r\nI suspect that something like a missing callback or event in the example may be causing the issue.\r\n\r\nAlex', 'Replaced the http calls with request.js.\r\n\r\nThanks.', ""I'm pretty sure I can see the issue now. You are referring to `localhost` from within a Docker container... that will not do what you're expecting. I think it may be calling the function recursively.\r\n\r\nCheck this line:\r\nhttps://github.com/satie/helloworld-faas/blob/master/helloworld/handler.js#L6\r\n\r\nYou should use `gateway` or `gateway.openfaas` not `localhost`. Please try it again and let me know.\r\n\r\nSee also the workshop which I think may cover this - https://github.com/openfaas/workshop\r\n\r\nPS: I checked the linked document and it does say to use `gateway`- https://github.com/openfaas/faas/blob/master/guide/chaining_functions.md#function-director-pattern"", 'That seems to have done the trick. Thanks for pointing that out. I kind of thought that `gateway` was suggested more on general terms. ', '@alexellis In OpenFaas is this the equivalent of Apache OpenWhisk Action Sequence?']}"
634,function with custom response for twilio,https://github.com/openfaas/faas/issues/634,"{'description': 'I\'m working on an OpenFaaS function that accepts webhook requests from Twilio based on incoming text messages. The standard Twilio response is packaged as XML, so the encoded message must be ""text/xml"" The current Python template just responds as text and thus creates an error in Twilio. \r\n\r\nIn my ```handler.py``` I am using print or return, but they result in an error within Twilio. \r\n\r\n## Expected Behaviour\r\nI want a way in the Python function to format the response contentType to ""text/xml"" \r\n\r\n## Current Behaviour\r\nIt looks like the response contentType is ""application/x-www-form-urlencoded"" The messages look like this: ```<?xml version=""1.0"" encoding=""UTF-8""?><Response><Message>Ahoy! Thanks so much for your message.</Message></Response>```\r\n\r\n## Possible Solution\r\n\r\n\r\n## Steps to Reproduce (for bugs)\r\nI created my function using the steps here: https://docs.openfaas.com/tutorials/first-python-function \r\n\r\nThe Twilio details are here: https://www.twilio.com/docs/sms/quickstart/python \r\n\r\n## Context\r\n\r\n\r\n## Your Environment\r\nOpenFaas on AKS\r\n\r\n* Are you using Docker Swarm or Kubernetes (FaaS-netes)?\r\nKubernetes\r\n\r\n* Operating System and version (e.g. Linux, Windows, MacOS):\r\nMacOS \r\n\r\n* My handler.py code looks like this: \r\n\r\n```\r\nimport requests\r\nimport json\r\nfrom log import Log\r\nfrom twilio.twiml.messaging_response import MessagingResponse\r\n\r\ndef handle(req):\r\n    log = Log()\r\n\r\n   # Add code here to parse payload\r\n\r\n    # Start our response\r\n    resp = MessagingResponse()\r\n\r\n    # Add a message\r\n    resp.message(""Ahoy! Thanks so much for your message."")\r\n    \r\n    log.info(str(resp))\r\n    return str(resp)\r\n```\r\n\r\n', 'comments': ['Hi @chzbrgr71! It sounds like you\'re in need of the updated watchdog that handles function via an ""http mode"". This means you can set the headers, content type, response status, etc...\r\nCheck it out here: https://github.com/openfaas-incubator/of-watchdog\r\n\r\nAnd for you, here\'s the Python/Flask template to start off with: https://github.com/openfaas-incubator/python-flask-template', 'Thank you for the help!!! I was able to try this out and it worked perfectly. I made zero changes to my code. Only changed to the above template. ', ""That's great news! :tada: \r\nThe of-watchdog is still in the incubator, so please do raise an issue if you find something out of place"", 'Hi @chzbrgr71 Burton\'s advice is valid but there\'s an even easier way to do what you needed.\r\n\r\nJust set an environmental variable of ""content_type: text/xml"" when you deploy your function. No other changes are required. \r\n\r\nWe will cover this in the official workshop soon too: https://github.com/openfaas/workshop/issues/30\r\n\r\nI\'d encourage you to work through the workshop and learn how to configure functions - it\'s based around Python which is relevant to your Twilio code.']}"
