Issue ID,Issue Title,GitHub Link,Issue Details
1567,wrong content-type header when calling function through gateway,https://github.com/openfaas/faas/issues/1567,"{'description': '<!-- Due dilligence -->\r\n\r\n## My actions before raising this issue\r\n- [x] Followed the [troubleshooting guide](https://docs.openfaas.com/deployment/troubleshooting/)\r\n- [x] Read/searched [the docs](https://docs.openfaas.com/)\r\n- [x] Searched [past issues](/issues)\r\n\r\n<!--- Provide a general summary of the issue in the Title above -->\r\n\r\n\r\n## Expected Behaviour\r\n<!--- If you\'re describing a bug, tell us what should happen -->\r\n<!--- If you\'re suggesting a change/improvement, tell us how it should work -->\r\nWhen a function is called through the gateway, it should return the same headers (and specifically the same content-type header) than when it\'s called directly.\r\n\r\n## Current Behaviour\r\n<!--- If describing a bug, tell us what happens instead of the expected behavior -->\r\n<!--- If suggesting a change/improvement, explain the difference from current behavior -->\r\nWhen a function is called through gateway, if direct_functions parameter is set to false, content-type return header is equal to the content-type header sent by the client.\r\n\r\nAs an example, I have called a function directly (port 8080, through openfaas-watchdog), returned content-type is correct : \r\n\r\n```\r\n> POST / HTTP/1.1\r\n> Host: splitter-permis.axa-fr-dev-int.teal.westeurope.azure.openpaas.axa-cloud.com\r\n> User-Agent: curl/7.64.1\r\n> Accept: */*\r\n> Content-Length: 118212\r\n> Content-Type: multipart/form-data; boundary=------------------------3a7a50e10eb396f9\r\n> Expect: 100-continue\r\n>\r\n< HTTP/1.1 100 Continue\r\n* We are completely uploaded and fine\r\n< HTTP/1.1 200 OK\r\n< content-length: 471\r\n< content-type: application/json\r\n< date: Mon, 31 Aug 2020 12:51:43 GMT\r\n< x-duration-seconds: 2.179032\r\n< set-cookie: 0c76b3b7e3633de0795f8b70331200d1=1778425f7f0222fcd72a67a69b8b2d83; path=/; HttpOnly; Secure\r\n<\r\n{""files"":[{""filename"":""saltstack-enterprise-release-notes-6_2_0.pdf-1.png"",""height"":2200,""id"":""f5879bfa-e0e3-46ba-9c5a-7a3bfba694c5"",""page_number"":1,""width"":1700},{""filename"":""saltstack-enterprise-release-notes-6_2_0.pdf-2.png"",""height"":2200,""id"":""48093010-31fa-464c-a400-6cd1bf98116e"",""page_number"":2,""width"":1700},{""filename"":""saltstack-enterprise-release-notes-6_2_0.pdf-3.png"",""height"":2200,""id"":""0f933a3d-31de-43cf-9131-fbc94c955afc"",""page_number"":3,""width"":1700}]}\r\n* Connection #0 to host splitter-permis.axa-fr-dev-int.teal.westeurope.azure.openpaas.axa-cloud.com left intact\r\n```\r\n\r\nSame function, this time through openfaas gateway, returned content-type is wrong : \r\n\r\n```\r\n> POST /function/license-splitter HTTP/1.1\r\n> Host: permis-openfaas.axa-fr-dev-int.teal.westeurope.azure.openpaas.axa-cloud.com\r\n> User-Agent: curl/7.64.1\r\n> Accept: */*\r\n> Content-Length: 118212\r\n> Content-Type: multipart/form-data; boundary=------------------------f01cc375500cc272\r\n> Expect: 100-continue\r\n>\r\n< HTTP/1.1 100 Continue\r\n* We are completely uploaded and fine\r\n< HTTP/1.1 200 OK\r\n< content-length: 471\r\n< content-type: multipart/form-data; boundary=------------------------f01cc375500cc272\r\n< date: Mon, 31 Aug 2020 12:33:32 GMT\r\n< x-duration-seconds: 2.156178\r\n< set-cookie: 9757cb406d295d7baa9a8e457d584d0a=44c1eb50977a4a0a264409ad1f7f2217; path=/; HttpOnly; Secure\r\n<\r\n{""files"":[{""filename"":""saltstack-enterprise-release-notes-6_2_0.pdf-1.png"",""height"":2200,""id"":""39110274-f359-4d10-a835-a7a1e9663343"",""page_number"":1,""width"":1700},{""filename"":""saltstack-enterprise-release-notes-6_2_0.pdf-2.png"",""height"":2200,""id"":""499ed6fe-8c48-4bbd-8689-550f38399c8f"",""page_number"":2,""width"":1700},{""filename"":""saltstack-enterprise-release-notes-6_2_0.pdf-3.png"",""height"":2200,""id"":""d607cf27-77f5-4962-99b2-6bc416e73133"",""page_number"":3,""width"":1700}]}\r\n* Connection #0 to host permis-openfaas.axa-fr-dev-int.teal.westeurope.azure.openpaas.axa-cloud.com left intact\r\n```\r\n\r\n## Possible Solution\r\n<!--- Not obligatory, but suggest a fix/reason for the bug, -->\r\n<!--- or ideas how to implement the addition or change -->\r\nI have found another issue, describing the exact same behavior, but closed in 2017, so maybe same problem but different root cause : https://github.com/openfaas/faas/issues/312\r\n\r\n## Steps to Reproduce (for bugs)\r\n<!--- Provide a link to a live example, or an unambiguous set of steps to -->\r\n<!--- reproduce this bug. Include code to reproduce, if relevant -->\r\n1. Deploy openfaas with direct_functions set to false.\r\n2. Deploy a function asking for a multipart upload and answering with a json (for example).\r\n3. Call this function with curl -v through gateway, and check returned content-type header.\r\n\r\n## Context\r\n<!--- How has this issue affected you? What are you trying to accomplish? -->\r\n<!--- Providing context helps us come up with a solution that is most useful in the real world -->\r\n\r\n\r\n## Your Environment\r\n<!--- Include as many relevant details about the environment you experienced the bug in -->\r\n* FaaS-CLI version ( Full output from: `faas-cli version` ):\r\n0.12.4\r\n\r\n* Docker version `docker version` (e.g. Docker 17.0.05 ):\r\n19.03.13-beta2\r\n\r\n* Are you using Docker Swarm or Kubernetes (FaaS-netes)?\r\nKubernetes\r\n\r\n* Operating System and version (e.g. Linux, Windows, MacOS):\r\nMacOs 10.15.4\r\n\r\n* Code example or link to GitHub repo or gist to reproduce problem:\r\n\r\n* Other diagnostic information / logs from [troubleshooting guide](https://docs.openfaas.com/deployment/troubleshooting)\r\n\r\nIf using Swarm, run the following and include the output:\r\n\r\n```\r\ncurl -sLS https://raw.githubusercontent.com/moby/moby/master/contrib/check-config.sh | bash\r\n```\r\n\r\n## Next steps\r\n\r\nYou may [join Slack](https://docs.openfaas.com/community) for community support.\r\n\r\n', 'comments': ['Please help us to help you by providing a Github repository that we can use to reproduce your issue among with detailed instructions.', '@tlemarchand hope to hear back from you soon? Do you still need this issue open?', '@alexellis Thanks for your answer. I still have the issue. Unfortunately the functions that are impacted are not public, and I have not found any public function working with an multipart upload and returning json or something else.\r\nSo I have to put up a mock to make it easily reproducible, it might take a few days ...', ""Ok, but this shouldn't really take days to reproduce. Perhaps find a simple upload example for express.js or whatever you're using and use that? I'll keep the issue open another week. "", '@alexellis you\'re right, it didn\'t took days (a nice colleague built a mock function for me) !\r\n\r\nSteps to reproduce, on OpenFaas with operator over Kubernetes and direct_functions set to false :\r\n\r\n1. Deploy this function : \r\n```\r\napiVersion: openfaas.com/v1\r\nkind: Function\r\nmetadata:\r\n  name: mock\r\nspec:\r\n  environment:\r\n    combine_output: ""false""\r\n    log_level: ERROR\r\n    read_debug: ""true""\r\n    read_timeout: 10s\r\n    write_debug: ""true""\r\n    write_timeout: 10s\r\n  image: tlemarchand/mock-function:v0\r\n  labels:\r\n    com.openfaas.scale.min: ""1""\r\n  limits:\r\n    cpu: 50m\r\n    memory: 256Mi\r\n  name: mock\r\n  requests:\r\n    cpu: 25m\r\n    memory: 128Mi\r\n```\r\n\r\n2. Upload a PDF to the function through the gateway ( : \r\n`curl -v -X POST -F file=@""/home/thomas/test.pdf"" https://gateway.openfaas/function/mock`\r\nAnd check the return : \r\n```\r\n> POST /function/mock HTTP/1.1\r\n> Host: gateway.openfaas\r\n> User-Agent: curl/7.64.1\r\n> Accept: */*\r\n> Content-Length: 118212\r\n> Content-Type: multipart/form-data; boundary=------------------------acc50ded887785be\r\n> Expect: 100-continue\r\n>\r\n< HTTP/1.1 100 Continue\r\n* We are completely uploaded and fine\r\n< HTTP/1.1 200 OK\r\n< content-length: 129\r\n< content-type: multipart/form-data; boundary=------------------------acc50ded887785be\r\n< date: Fri, 04 Sep 2020 12:58:04 GMT\r\n< x-duration-seconds: 0.865100\r\n< set-cookie: 9757cb406d295d7baa9a8e457d584d0a=66cfc9bb9377472353f808963f5d90fc; path=/; HttpOnly; Secure\r\n<\r\n[{""confidence"":0.9834659099578857,""coordinates"":{""xmax"":411,""xmin"":-9,""ymax"":1104,""ymin"":-53},""document_id"":""0"",""label"":""mock""}]\r\n```\r\nReturned content-type header is wrong.\r\n\r\n3. Expose the function directly to bypass the gateway (did it with a route, but you can do the same with an ingress) : \r\n```\r\nkind: Route\r\napiVersion: route.openshift.io/v1\r\nmetadata:\r\n  name: mock\r\nspec:\r\n  host: mock.direct\r\n  to:\r\n    kind: Service\r\n    name: mock\r\n    weight: 100\r\n  port:\r\n    targetPort: http\r\n  tls:\r\n    termination: edge\r\n    insecureEdgeTerminationPolicy: None\r\n  wildcardPolicy: None\r\n```\r\n\r\n4. Upload same PDF to the function directly : \r\n`curl -v -X POST -F file=@""/home/thomas/test.pdf"" https://mock.direct/`\r\nAnd check the return : \r\n```\r\n> POST / HTTP/1.1\r\n> Host: mock.direct\r\n> User-Agent: curl/7.64.1\r\n> Accept: */*\r\n> Content-Length: 118212\r\n> Content-Type: multipart/form-data; boundary=------------------------4140fb8cc6f9a44a\r\n> Expect: 100-continue\r\n>\r\n< HTTP/1.1 100 Continue\r\n* We are completely uploaded and fine\r\n< HTTP/1.1 200 OK\r\n< content-length: 129\r\n< content-type: application/json\r\n< date: Fri, 04 Sep 2020 13:09:50 GMT\r\n< x-duration-seconds: 0.356345\r\n< set-cookie: 8ac40157395f389a681c21b2265cd916=383e2a4e214d222b7af35b5c53542117; path=/; HttpOnly; Secure\r\n<\r\n[{""confidence"":0.9834659099578857,""coordinates"":{""xmax"":411,""xmin"":-9,""ymax"":1104,""ymin"":-53},""document_id"":""0"",""label"":""mock""}]\r\n```\r\nReturned content-type header is correct.', '/lock: closing due to inactivity']}"
1569,function deployment finish but not ready on ui and  liveness probe failed warning in pod,https://github.com/openfaas/faas/issues/1569,"{'description': ""<!-- Due dilligence -->\r\n\r\n## My actions before raising this issue\r\n- [x] Followed the [troubleshooting guide](https://docs.openfaas.com/deployment/troubleshooting/)\r\n- [x] Read/searched [the docs](https://docs.openfaas.com/)\r\n- [x] Searched [past issues](/issues)\r\n\r\n<!--- Provide a general summary of the issue in the Title above -->\r\n\r\nI have initially installed openfaas and work fine in the newly created kubernetes cluster (v 1.18).\r\nAnd then i try to install kuberflow v.1.1 on the same cluster. \r\nIf i try to deploy an new function, I will encounter liveness probe failed in the pod, and see Not Ready on UI.\r\nHowever, the status of the pod and service are in running status.  Also, all other previous deployed openfaas functions are still working.\r\n\r\n## Expected Behaviour\r\n<!--- If you're describing a bug, tell us what should happen -->\r\nI am expecting the deployed function to be in Ready status on UI.\r\n\r\n<!--- If you're suggesting a change/improvement, tell us how it should work -->\r\n\r\n\r\n## Current Behaviour\r\n<!--- If describing a bug, tell us what happens instead of the expected behavior -->\r\n I will encounter liveness probe failed in the pod, and see Not Ready on UI.\r\n<!--- If suggesting a change/improvement, explain the difference from current behavior -->\r\n\r\n\r\n## Possible Solution\r\n<!--- Not obligatory, but suggest a fix/reason for the bug, -->\r\nI wonder if it is caused by kuberflow installation. They are using istio as well. \r\nWould you please suggest how to debug and fix/workaround it ?\r\n\r\n<!--- or ideas how to implement the addition or change -->\r\n\r\n\r\n## Steps to Reproduce (for bugs)\r\n<!--- Provide a link to a live example, or an unambiguous set of steps to -->\r\n<!--- reproduce this bug. Include code to reproduce, if relevant -->\r\n1. Install OpenFaas \r\n2. Deploy functions, and everything works\r\n3. Install Kubeflow v.1.1\r\n4. Deploy functions, and function shows Not Ready on UI.\r\n\r\n## Context\r\n<!--- How has this issue affected you? What are you trying to accomplish? -->\r\nI am trying to deploy a function to openfaas.\r\n\r\n<!--- Providing context helps us come up with a solution that is most useful in the real world -->\r\n\r\n\r\n## Your Environment\r\n<!--- Include as many relevant details about the environment you experienced the bug in -->\r\n* FaaS-CLI version ( Full output from: `faas-cli version` ):\r\nCLI:\r\n commit:  f7c29ea19b5df9d7aa87e9c70aacf4d9315da2cd\r\n version: 0.12.4\r\nYour faas-cli version (0.12.4) may be out of date. Version: 0.12.9 is now available on GitHub.\r\n\r\n* Docker version `docker version` (e.g. Docker 17.0.05 ):\r\n\r\n* Are you using Docker Swarm or Kubernetes (FaaS-netes)?\r\nKubernetes \r\n\r\n* Operating System and version (e.g. Linux, Windows, MacOS):\r\n\r\n* Code example or link to GitHub repo or gist to reproduce problem:\r\n\r\n* Other diagnostic information / logs from [troubleshooting guide](https://docs.openfaas.com/deployment/troubleshooting)\r\nFunction pod log, not sure why it is refering to gcr.io for istio-proxy.\r\n![image](https://user-images.githubusercontent.com/52347372/93152224-37934a00-f752-11ea-98ac-7d26e348ddc7.png)\r\n\r\nFunction service log comparison. Previous deployed function is working. Newly deployed function is not working.\r\n![image](https://user-images.githubusercontent.com/52347372/93149321-1cbcd780-f74a-11ea-8516-187d6d7c9a2c.png)\r\n\r\n\r\n\r\nIf using Swarm, run the following and include the output:\r\n\r\n```\r\ncurl -sLS https://raw.githubusercontent.com/moby/moby/master/contrib/check-config.sh | bash\r\n```\r\n\r\n## Next steps\r\n\r\nYou may [join Slack](https://docs.openfaas.com/community) for community support.\r\n\r\n"", 'comments': ['I managed to make it work by uninstalling kubeflow.\r\n\r\nAlso, need to follow this step if istio is running on the same cluster.\r\nhttps://www.kubeflow.org/docs/started/k8s/kfctl-k8s-istio/\r\n\r\nBefore you start\r\nConfiguring your installation with kfctl_k8s_istio.v1.1.0.yaml has an option you should consider:\r\n\r\nDisabling istio installation - If your Kubernetes cluster has an existing Istio installation you may choose to not install Istio by removing the applications istio-crds and istio-install in the configuration file kfctl_k8s_istio.v1.1.0.yaml', 'Glad you were able to solve your own issue. There are some community resources for Istio, which may be of help.\r\n\r\nhttps://docs.openfaas.com/tutorials/featured/#service-mesh', '/lock']}"
1578,typo in swagger yaml (openapi definition),https://github.com/openfaas/faas/issues/1578,"{'description': 'There is a typo in the [Swagger YAML file](https://github.com/openfaas/faas/blob/master/api-docs/swagger.yml).\r\n`FunctionDefintion` should be `FunctionDefinition`', 'comments': ['@viveksyngh could you send us a PR to fix this please?', 'Thanks @noam09 ', 'Yankee can you take this?', 'Yeah sure @alexellis ', 'Thank you both!']}"
1585,github actions migration - tracking issue,https://github.com/openfaas/faas/issues/1585,"{'description': '# Inlets\r\n- [x] https://github.com/inlets/inlets-operator @jsiebens\r\n- [x] https://github.com/inlets/inletsctl\r\n- [ ] https://github.com/inlets/inlets\r\n\r\nalexellis\r\n- [x] k3sup @alexellis \r\n- [x] arkade @Waterdrips \r\n- [ ] https://github.com/alexellis/derek\r\n\r\n# openfaas\r\n\r\nMerged:\r\n- [x] https://github.com/openfaas/faas-netes @akosveres\r\n- [x] https://github.com/openfaas/templates @Waterdrips \r\n- [x] https://github.com/openfaas/nats-connector @CodeCutterUK \r\n- [x] https://github.com/openfaas/faasd @akosveres\r\n- [x] https://github.com/openfaas/ofc-bootstrap @Waterdrips \r\n- [x] https://github.com/openfaas/faas-provider closed in https://github.com/openfaas/faas-provider/pull/49\r\n- [x] https://github.com/openfaas/faas-cli\r\n- [x] https://github.com/openfaas/kafka-connector\r\n- [x] https://github.com/openfaas/cron-connector\r\n- [x] https://github.com/openfaas/openfaas-cloud @Waterdrips \r\n\r\nWaiting on Review:\r\n- [ ] https://github.com/openfaas/nats-queue-worker pending: https://github.com/openfaas/nats-queue-worker/pull/103\r\n- [ ] https://github.com/openfaas/ingress-operator pending: https://github.com/openfaas/ingress-operator/pull/42\r\n- [ ] https://github.com/openfaas/faas-idler pending https://github.com/openfaas/faas-idler/pull/44\r\n- [ ] https://github.com/openfaas/faas-swarm pending: https://github.com/openfaas/faas-swarm/pull/76\r\n- [ ] https://github.com/openfaas/certifier pending https://github.com/openfaas/certifier/pull/58\r\n- [ ] https://github.com/openfaas/of-watchdog pending https://github.com/openfaas/of-watchdog/pull/114\r\n- [ ] https://github.com/openfaas/connector-sdk pending https://github.com/openfaas/connector-sdk/pull/53\r\n- [ ] https://github.com/openfaas/faas pending https://github.com/openfaas/faas/pull/1598\r\n\r\n\r\nPending:\r\n\r\n- [ ] https://github.com/openfaas/store\r\n- [ ] https://github.com/openfaas/mqtt-connector\r\n\r\n\r\n# OpenFaaS Incubator \r\n- [ ] https://github.com/openfaas-incubator/openfaas-sqs-connector \r\n- [ ] https://github.com/openfaas-incubator/openfaas-vcenter-connector', 'comments': ['/open', '/reopen\r\n', 'Folks unfortunately the first set of merged PRs did not work as I don\'t believe that we tested them in our branches with a release tag before submitting the PR and asking for a merge. Let\'s tighten up our work before asking for a merge?\r\n\r\n## Make sure release tags work\r\n\r\nI also noticed that the Docker v2 build/push action does not copy in a .git folder, this can be worked-around as follows (with a path and context). When these are missing, the code does a fresh clone / checkout of the code and lacks the .git folder used to get versions and tags.\r\n\r\n```yaml\r\n      - name: Build multi-arch containers for validation only\r\n        uses: docker/build-push-action@v2\r\n        with:\r\n          context: .\r\n          file: ./Dockerfile\r\n          outputs: ""type=image,push=false""\r\n          platforms: linux/amd64,linux/arm/v7,linux/arm64\r\n          tags: |\r\n            ghcr.io/openfaas/faas-netes:${{ github.sha }}\r\n```\r\n\r\n## Include a NS variable in the image name\r\n\r\nIn order to test in our own repos, we should each have some way of overwriting `ghcr.io/openfaas/faas-netes:${{ github.sha }}` with our own username i.e. `ghcr.io/NS/faas-netes:${{ github.sha }}` where NS is a GitHub Action env-var. Have a look at https://docs.github.com/en/free-pro-team@latest/actions/reference/environment-variables\r\n\r\n## Keep naming consistent\r\n\r\nI noticed that in most PRs people changed the name of the build and publish step to whatever they preferred. Please don\'t. Let\'s make sure this is consistent for future maintenance. Match the build job with the filename too. \r\n\r\n## Build on `*`\r\n\r\nMany PRs just assumed only master would be used\r\n\r\n```yaml\r\non:\r\n  push:\r\n    branches:\r\n    - \'*\'\r\n  pull_request:\r\n    branches:\r\n    - \'*\'\r\n```\r\n\r\n* build.yaml - upon `*` for push and branches\r\n* publish.yaml - upon tags\r\n\r\n## Make sure this is multi-arch with buildx\r\n\r\nWe need to build for multiple architectures, not just `x86_64` - see the faas-netes build or the [other references examples on trello](https://trello.com/c/uqaun5lI/172-4th-nov-development-call).\r\n\r\n## Remove `.travis.yml` and `travis_terminate`\r\n\r\nRemove the `.travis.yml` file\r\n\r\nRemove the `travis_terminate` command in bash files.\r\n\r\n## Make sure the Go version is set when required\r\n\r\n```yaml\r\n\r\njobs:\r\n  build:\r\n    strategy:\r\n      matrix:\r\n        go-version: [1.13.x]\r\n        os: [ubuntu-latest]\r\n    runs-on: ${{ matrix.os }}\r\n    steps:\r\n      - uses: actions/checkout@master\r\n        with:\r\n          fetch-depth: 1\r\n      - name: Install Go\r\n        uses: actions/setup-go@v2\r\n        with:\r\n          go-version: ${{ matrix.go-version }}\r\n```\r\n\r\nSome people set the Go version to 1.11, 1.9 and 1.14 - for the time being we\'re using 1.13, but only configure the Go version if Go is used in the actions. For most of the openfaas repos Go isn\'t used at all at build-time, Docker is.\r\n\r\n## Link the artifact to the repo\r\n\r\n<img width=""1041"" alt=""Screenshot 2020-11-11 at 16 57 00"" src=""https://user-images.githubusercontent.com/6358735/98840660-f7dd9b80-243e-11eb-98f3-368b69626286.png"">\r\n', 'fyi you can get the repo name like this in an action\r\n```\r\n      - name: Get Repo\r\n        id: get_repo\r\n        run: echo ::set-output name=repo_owner::$(echo ${{ github.repository_owner }} | tr \'[:upper:]\' \'[:lower:]\')\r\n```\r\n\r\nthen ref it with this\r\n```\r\n            ghcr.io/${{ steps.get_repo.outputs.repo_owner }}/${{ matrix.svc }}:latest\r\n```\r\n\r\n\r\nthen users use ${{ github.repository_owner }} as the ""DOCKER_USERNAME"" for the docker login, rather than needing to set a secret to allow pusing to a user\'s ghcr repo while testing.\r\n\r\n\r\n(edit, changed based on conversations below, so may not make sense in those convos now)', ""@Waterdrips Yes but the catch is `event` isn't always included from what I've read, although that might only be for scheduled triggers....it's probably fine in the context of openfaas builds though, but not really my call."", 'it looks like its only scheduled builds that dont have events from the docs and forums, we dont use those currently. ', ""So using this instead of `github.repository_owner` or the currently undocumented env `GITHUB_REPOSITORY_OWNER` results in the same issue if the repo owner string is storied in a secret, which is highly likely given that the GHCR username would like be stored as a secret. Again likely not an issue for repos in a 'proper' org like, but would likely be an issue for forks thus not fully solving the issue we wanted to solve.\r\n\r\nYou can see the issue here: https://github.com/CodeCutterUK/nats-connector/runs/1395097635?check_suite_focus=true\r\nversus when the secrets are removed: https://github.com/CodeCutterUK/nats-connector/runs/1395105402?check_suite_focus=true"", 'I never found ${{ github.repository_owner }} - i have found the GH Actions docs to be not amazing... I like that more than using the event...\r\n \r\n\r\n/so as far as i can tell the problem is: \r\n\r\n* images need all lowrcase repos.\r\n* GHCR login needs your actual github username (With correct case) \r\n\r\nso we need both the explicit docker username, or use the non-lowercased repo owner (however we decide to get it) - need to decide how we manage this, we could use the ${{ github.repository_owner }} as the dockerhub login, and have a step that gets the lowercase version for image tags, repo path etc? ', '@CodeCutterUK updated based on the above:https://github.com/Waterdrips/openfaas-cloud/actions/runs/361500170 seems to work well without the secret existing', ""Yes, works perfectly without the lowercase version of the username as a secret :)\r\nAll a bit annoying really, I'm not sure there will be a work around without GH changing some code"", 'I completed the Github Action migration issue for the connector-sdk,  here is the link below:\r\nhttps://github.com/openfaas/connector-sdk/pull/53', ""Thanks to @cpanato who has volunteered to pick up the NATS queue worker. This will need a new PR, and I'd suggest using one of the other projects in this list as a template. For instance: https://github.com/openfaas/cron-connector""]}"
