Issue ID,Issue Title,GitHub Link,Issue Details
1086,runc processes for functions constantly spawning,https://github.com/openfaas/faas/issues/1086,"{'description': 'When adding and scaling functions to an OpenFaas deployment running on Docker Swarm, runc processes are constantly exeucting for each instance of each function, and containerd-shim is consistently using 0.7% CPU per container\r\n\r\n## Expected Behaviour\r\nIdle functions doing no work should use little to no CPU\r\n\r\n## Current Behaviour\r\nExtensive CPU is being used, even when functions are idle, about 1% of the processor per instance deployed\r\n\r\n## Possible Solution\r\n\r\n## Steps to Reproduce (for bugs)\r\n1. Deploy OpenFaas via Docker Swarm\r\n2. Deploy one or more functions to OpenFaas\r\n3. Scale functions above 1\r\n\r\n## Context\r\nThis issue is causing extreme performance degradation as half or more of CPU resources on each Swarm node is being consumed.by containerd-shim and runc.\r\n\r\n## Your Environment\r\n<!--- Include as many relevant details about the environment you experienced the bug in -->\r\n* FaaS-CLI version ( Full output from: `faas-cli version` ):\r\nNot using FaaS-CLI\r\n\r\n* Docker version `docker version` (e.g. Docker 17.0.05 ):\r\nDocker 18.09.01\r\n\r\n* Are you using Docker Swarm or Kubernetes (FaaS-netes)?\r\nSwarm\r\n\r\n* Operating System and version (e.g. Linux, Windows, MacOS):\r\nUbuntu 16.04\r\n\r\n* Link to your project or a code example to reproduce issue:\r\n\r\n* Please also follow the [troubleshooting guide](https://github.com/openfaas/faas/blob/master/guide/troubleshooting.md) and paste in any other diagnostic information you have:\r\n\r\nNothing in the troubleshooting guide references this problem.  The functions are executing, just with reduced speed because other resources are being consumed.  Below are example lines from an auditd log, note that runc is running on the same docker container over and over, but `docker ps` shows the container continuously running (not like it is exiting and restarting).\r\n```\r\ntype=EXECVE msg=audit(1550080419.553:16698): argc=9 a0=""runc"" a1=""--root"" a2=""/var/run/docker/runtime-runc/moby"" a3=""--log"" a4=""/run/docker/containerd/daemon/io.containerd.runtime.v1.linux/moby/d648526189b7116c6c11a8b28d450eba4acff121a6a502c84e45a4c0b26aaf9e/log.json"" a5=""--log-format"" a6=""json"" a7=""state"" a8=""d648526189b7116c6c11a8b28d450eba4acff121a6a502c84e45a4c0b26aaf9e""\r\ntype=CWD msg=audit(1550080419.553:16698):  cwd=""/run/docker/containerd/daemon/io.containerd.runtime.v1.linux/moby/d648526189b7116c6c11a8b28d450eba4acff121a6a502c84e45a4c0b26aaf9e""\r\ntype=EXECVE msg=audit(1550080420.089:16735): argc=9 a0=""runc"" a1=""--root"" a2=""/var/run/docker/runtime-runc/moby"" a3=""--log"" a4=""/run/docker/containerd/daemon/io.containerd.runtime.v1.linux/moby/d648526189b7116c6c11a8b28d450eba4acff121a6a502c84e45a4c0b26aaf9e/log.json"" a5=""--log-format"" a6=""json"" a7=""state"" a8=""d648526189b7116c6c11a8b28d450eba4acff121a6a502c84e45a4c0b26aaf9e""\r\ntype=CWD msg=audit(1550080420.089:16735):  cwd=""/run/docker/containerd/daemon/io.containerd.runtime.v1.linux/moby/d648526189b7116c6c11a8b28d450eba4acff121a6a502c84e45a4c0b26aaf9e""\r\ntype=EXECVE msg=audit(1550080420.389:16771): argc=9 a0=""runc"" a1=""--root"" a2=""/var/run/docker/runtime-runc/moby"" a3=""--log"" a4=""/run/docker/containerd/daemon/io.containerd.runtime.v1.linux/moby/d648526189b7116c6c11a8b28d450eba4acff121a6a502c84e45a4c0b26aaf9e/log.json"" a5=""--log-format"" a6=""json"" a7=""state"" a8=""d648526189b7116c6c11a8b28d450eba4acff121a6a502c84e45a4c0b26aaf9e""\r\ntype=CWD msg=audit(1550080420.389:16771):  cwd=""/run/docker/containerd/daemon/io.containerd.runtime.v1.linux/moby/d648526189b7116c6c11a8b28d450eba4acff121a6a502c84e45a4c0b26aaf9e""\r\ntype=EXECVE msg=audit(1550080422.541:16934): argc=9 a0=""runc"" a1=""--root"" a2=""/var/run/docker/runtime-runc/moby"" a3=""--log"" a4=""/run/docker/containerd/daemon/io.containerd.runtime.v1.linux/moby/d648526189b7116c6c11a8b28d450eba4acff121a6a502c84e45a4c0b26aaf9e/log.json"" a5=""--log-format"" a6=""json"" a7=""state"" a8=""d648526189b7116c6c11a8b28d450eba4acff121a6a502c84e45a4c0b26aaf9e""\r\ntype=CWD msg=audit(1550080422.541:16934):  cwd=""/run/docker/containerd/daemon/io.containerd.runtime.v1.linux/moby/d648526189b7116c6c11a8b28d450eba4acff121a6a502c84e45a4c0b26aaf9e""\r\n```\r\n\r\nThis runs continuously until the service are scaled down to 0.\r\n', 'comments': [""I may have figured out at least part of the issue.  I removed the HEALTHCHECK from the Dockerfile that bulds these functions (it was based on the python3 template Dockerfile), and rebuilt, and there is no longer a containerd-shim issue.  This might be my environment, apparently our rack has I/O issues, and since the healthcheck is looking for a file it may have simply been stalling too much time on I/O. The runc executions I'm guessing are how the healthchecks are run by the underlying Docker engine.  This can probably be closed."", 'Derek close']}"
1091,ability to specify the port in the deploy script as an argument,https://github.com/openfaas/faas/issues/1091,"{'description': 'The `docker-compose.yml` file has the port for the UI hardcoded, so a small change to the `deploy_stack` file and `docker-compose.yml` will allow to dynamically change it without editing any file directly.\r\n\r\n## Expected Behaviour\r\nAn example for the suggested changes:\r\n\r\n```\r\n./deploy_stack.sh --port 80\r\n```\r\nThis will allow the UI to run on port 80 instead of 8080.\r\n\r\nAlso the same would be for `deploy_stack.armhf.sh`\r\n\r\n## Current Behaviour\r\nRight now `deploy_stack.armhf.sh` does not accept any argument, mean while `deploy_stack.sh` accept only accepts `--no-auth` and `--help`.\r\n\r\n## Possible Solution\r\n\r\n1. Edit the `deploy_stack.sh` to export the environment variable \r\n```\r\nexport DEFAULT_PORT=""8080""\r\n\r\nwhile [ ! $# -eq 0 ]\r\ndo\r\n  case ""$1"" in\r\n    --port | -p)\r\n      if [ ! -z ""$2"" ];\r\n      then\r\n        export DEFAULT_PORT=$2\r\n      fi\r\n      ;;    \r\n    --no-auth | -n)\r\n      export BASIC_AUTH=""false""\r\n      ;;\r\n    --help | -h)\r\n      echo ""Usage: \\n [default]\\tdeploy the OpenFaaS core services\\n --no-auth [-n]\\tdisable basic authentication.\\n --port [-p]\\tdefine a new exposed port for the UI.\\n --help\\tdisplays this screen""\r\n      exit\r\n      ;;\r\n  esac\r\n  shift\r\ndone\r\n```\r\n\r\n2. Edit the `docker-compose` files to use the environment variable \r\n```\r\nversion: ""3.3""\r\nservices:\r\n    gateway:\r\n        ports:\r\n            - ${DEFAULT_PORT}:8080\r\n```\r\n\r\n3. Edit `deploy_stack.armhf.sh` and pass the arguments \r\n```\r\nsh ./deploy_stack.sh $1 $2\r\n```\r\n\r\n## Context\r\nThis will help to change the port for the UI without any manually edit to the files, not sure if this is something people may find useful or not.\r\n\r\n## Your Environment\r\n* FaaS-CLI version ( Full output from: `faas-cli version` ): \r\n0.8.3\r\n\r\n* Docker version `docker version` (e.g. Docker 17.0.05 ):\r\n18.09.2\r\n\r\n* Are you using Docker Swarm or Kubernetes (FaaS-netes)?\r\nSwarm\r\n\r\n* Operating System and version (e.g. Linux, Windows, MacOS):\r\nLinux/Mac\r\n\r\n* Link to your project or a code example to reproduce issue:\r\nhttps://github.com/linuxjuggler/faas/commit/b9fc73a1e370051f1528c127be9138373e3c0ce8\r\n\r\n* Please also follow the [troubleshooting guide](https://github.com/openfaas/faas/blob/master/guide/troubleshooting.md) and paste in any other diagnostic information you have:\r\n\r\n', 'comments': [""Hi @linuxjuggler, I am not sure this is something we want to do.  It might suggest that the gateway is ready to be exposed on a secure port like 443 when it isn't.  In a production deployment, it is recommended that the gateway be exposed via a load balancer like nginx, which can then change the public port to be 80 as well as supporting ssl and other features required to securely expose the gateway.\r\n\r\nIs there a specific use-case that you are trying to solve by changing the port?  \r\n\r\nEspecially for swarm, I think we would be better served by providing a walk through on customizing the deployment in the docs and making special notes about security concerns that need to be considered when making certain changes. "", 'Derek add label: wontfix\r\nDerek add label: revist\r\nDerek close', 'Derek remove label: wontfix Derek add label: revist Derek close', ""hey @LucasRoesler , thanks for the feedback\r\n\r\n> Is there a specific use-case that you are trying to solve by changing the port?\r\n\r\nThere is no special cause I am trying to solve here, except than manually editing the yaml files.\r\n\r\n> it is recommended that the gateway be exposed via a load balancer like nginx\r\n\r\nThis is what I just did, thanks for the note.\r\n\r\n> Especially for swarm, I think we would be better served by providing a walk through on customizing the deployment in the docs and making special notes about security concerns that need to be considered when making certain changes.\r\n\r\nTotally agree with you about that, for example, the docs do not explain where the CLI should installed, which is something am still trying to figure out.\r\n\r\nEither way, thank you very much again for the feedback 👍 \r\n\r\nAm going to close it, so it won't provide any false assumption for anyone else."", 'Derek add label: wontfix']}"
1092,scaleway: swarm with multiple nodes not working as expected,https://github.com/openfaas/faas/issues/1092,"{'description': 'Following the instructions to deploy OpenFaas on a swarm with multiple nodes returns ""Error pulling metrics from provider/backend. Status code: 502"" which can be read from the console tab within the browser developer tools.\r\n\r\n## Expected Behaviour\r\nThe UI should not have any problem, and the system should work.\r\n\r\n## Current Behaviour\r\n1. The UI returns a hidden error which can be read from the console, which indicates that the services have some problems communicating with each other.\r\n\r\n![screen shot 2019-02-19 at 10 32 57 am](https://user-images.githubusercontent.com/27624/52997507-caaeb580-3431-11e9-80f4-8f5b8646f232.png)\r\n\r\n2. The CLI will also throw an error when you try to log in:\r\n\r\n```\r\nServer returned unexpected status code: 500 - Error pulling metrics from provider/backend. Status code: 502\r\n```\r\n\r\n## Possible Solution\r\n<!--- Not obligatory, but suggest a fix/reason for the bug, -->\r\n<!--- or ideas how to implement the addition or change -->\r\n\r\n## Steps to Reproduce (for bugs)\r\n1. Create a small swarm with three nodes; they are all managers\r\n\r\n![screen shot 2019-02-19 at 9 43 19 am](https://user-images.githubusercontent.com/27624/52997680-46a8fd80-3432-11e9-9440-c68d09d20dc6.png)\r\n\r\nThere is a hardware firewall between them with the following rules:\r\n* Allow all Outbound connections.\r\n* Allow Inbound ports: 22, 8080, 53, 4789, 2377, 2376, 7946\r\n\r\n![screen shot 2019-02-19 at 11 09 15 am](https://user-images.githubusercontent.com/27624/52999442-d2248d80-3436-11e9-95a7-7031f525aaf9.png)\r\n\r\n\r\n\r\n2. Add a small VPS in front of them with nginx installed and configured as a load balancer (with SSL termination using CloudFlare) which will load the requests between the three managers.\r\n\r\n```\r\nupstream swarm {\r\n    server     x.x.x.x:8080;\r\n    server     x.x.x.x:8080;\r\n    server     x.x.x.x:8080;\r\n}\r\n\r\nserver {\r\n    listen     80;\r\n    listen     443 ssl http2 default_server;\r\n\r\n    server_name x.x.x.x;\r\n\r\n    ssl        on;\r\n    ssl_certificate         /etc/nginx/ssl/certificate.pem;\r\n    ssl_certificate_key     /etc/nginx/ssl/certificate.key;\r\n\r\n    location / {\r\n        proxy_pass http://swarm;\r\n    }\r\n}\r\n```\r\n3. Execute the deploy command `./deploy_stack.sh` and wait a few sec for all the services to run.\r\n\r\n![screen shot 2019-02-19 at 9 44 10 am](https://user-images.githubusercontent.com/27624/52997880-cdf67100-3432-11e9-87e4-e4d104caccbd.png)\r\n\r\n4. Check the UI and log in, everything should work great, except the error you will notice whenever you try to deploy a function, in my case I get ""bad gateway"" response from Cloudflare http://d.zah.me/n56q1y\r\n\r\n5. Look at the developer console you will notice the error:\r\n\r\n![screen shot 2019-02-19 at 10 32 57 am](https://user-images.githubusercontent.com/27624/52997507-caaeb580-3431-11e9-80f4-8f5b8646f232.png)\r\n\r\n6. You try to login via the CLI, and you get the error:\r\n\r\n```\r\nServer returned unexpected status code: 500 - Error pulling metrics from provider/backend. Status code: 502\r\n```\r\n\r\n7. Looking at the gateway logs you will get the follwoing message, which indicate that the gateway cant find `faas-swarm` service:\r\n\r\n```\r\nfunc_gateway.1.sb0elhkc4kdw@master    | 2019/02/19 06:39:59 Forwarded [GET] to /system/functions - [502] - 0.009134 seconds\u2028func_gateway.1.sb0elhkc4kdw@master    | 2019/02/19 06:40:01 Get http://faas-swarm:8080/system/functions: dial tcp: lookup faas-swarm on 127.0.0.11:53: no such host\u2028func_gateway.1.sb0elhkc4kdw@master    | 2019/02/19 06:40:03 error with upstream request to: /system/functions, Get http://faas-swarm:8080/system/functions: dial tcp: lookup faas-swarm on 127.0.0.11:53: no such host\r\n```\r\n\r\n8. Running the command `docker stack ps func` you will notice that `faas-swarm` and `gateway` are not on the same node\r\n\r\n![screen shot 2019-02-19 at 9 39 35 am](https://user-images.githubusercontent.com/27624/52998214-c8e5f180-3433-11e9-871a-f3a89b4d84db.png)\r\n\r\n`faas-swarm` on master 2, meanwhile `gateway` on master 1.\r\n\r\n**PS**: One thing I might need to test more further is having a swarm from one manager and two workers.\r\n\r\n## Context\r\nAm sure this is not how the system should work if I switch all of this to only a swarm from one node it will work without any problem since they will all be on the same node.\r\nThe [lab1](https://github.com/openfaas/workshop/blob/master/lab1.md) assumes that you are going to use a swarm from one node.\r\n\r\n## Your Environment\r\n* FaaS-CLI version ( Full output from: `faas-cli version` ):\r\n commit:  a141dedf94ffeed84412365fd591bdc8999c5a1b\r\n version: 0.8.3\r\n\r\n* Docker version `docker version` (e.g. Docker 17.0.05 ):\r\n```Client:\r\n Version:           18.09.2\r\n API version:       1.39\r\n Go version:        go1.10.6\r\n Git commit:        6247962\r\n Built:             Sun Feb 10 04:13:50 2019\r\n OS/Arch:           linux/amd64\r\n Experimental:      false\r\n\r\nServer: Docker Engine - Community\r\n Engine:\r\n  Version:          18.09.2\r\n  API version:      1.39 (minimum version 1.12)\r\n  Go version:       go1.10.6\r\n  Git commit:       6247962\r\n  Built:            Sun Feb 10 03:42:13 2019\r\n  OS/Arch:          linux/amd64\r\n  Experimental:     false\r\n```\r\n\r\n* Are you using Docker Swarm or Kubernetes (FaaS-netes)?\r\nDocker Swarm\r\n\r\n* Operating System and version (e.g. Linux, Windows, MacOS):\r\nLinux Ubuntu Xenial (16.04 LTS) (GNU/Linux 4.4.0-142-generic x86_64),\r\non a Scaleway VPS (https://github.com/scaleway/image-ubuntu), I am using a small version they have built specifically for small servers\r\n\r\n* Please also follow the [troubleshooting guide](https://github.com/openfaas/faas/blob/master/guide/troubleshooting.md) and paste in any other diagnostic information you have:\r\nSteps to Reproduce section should have all the logs I\'ve collected\r\n', 'comments': ['Hi,\r\n\r\nThanks for your interest in OpenFaaS.\r\n\r\nI am unaware of any issues with Swarm or multiple node support.\r\n\r\nWhat I\'ve done is to spend some time to set up a 3-node cluster on Packet.net and take some screenshots to demonstrate that this worked without error:\r\n\r\n<img width=""1048"" alt=""screenshot 2019-02-19 at 08 17 41"" src=""https://user-images.githubusercontent.com/6358735/52999886-e0ff4600-341e-11e9-87bc-f017fc4f74d6.png"">\r\n\r\n<img width=""1670"" alt=""screenshot 2019-02-19 at 08 16 04"" src=""https://user-images.githubusercontent.com/6358735/52999887-e0ff4600-341e-11e9-86df-3f9ff296e20a.png"">\r\n\r\nHere\'s my thoughts:\r\n\r\nI can\'t reproduce any multi-node issue in Swarm with OpenFaaS, so it points to your environment:\r\n\r\nCould I make a suggestion? Perhaps using DigitalOcean\'s Kubernetes service would work out better for you? This is a cheap and effective service and their offering is reliable.\r\n\r\nWhat you may have is an issue with your cloud provider (Scaleway\'s kernel image). What Image did you use there? They have a ""Docker"" image which may work better.\r\n\r\nYour Nginx configuration could also be part of the problem, or the firewall rules you have picked.\r\n\r\nI\'m going to close this issue since it is not a problem with OpenFaaS, however if you can how that this issue is a problem with OpenFaaS we\'ll prioritise it and fix it.\r\n\r\n* Try DigitalOcean\r\n\r\nhttps://www.openfaas.com/blog/digitalocean-one-click/\r\nhttps://www.openfaas.com/blog/deploy-digitalocean-ansible/\r\nhttps://blog.alexellis.io/digitalocean-kubernetes-engine/\r\n\r\nI can suggest other clouds, but if you\'re using Scaleway, I assume that economy is important?\r\n\r\n* Use Scaleway support\r\n\r\n* Use the Docker Forum for support\r\n\r\nhttps://forums.docker.com\r\n\r\nGood luck\r\n\r\nAlex', ""Never mind guys, thanks for all the help.\r\n\r\nI'll go over all the notes that you have mentioned and see what is the issue.\r\n\r\nThanks again,\r\n\r\nHave a nice day"", ""I found the issue. The Firewall should have the port `53` open for both TCP/UDP \r\n\r\n![screen shot 2019-02-19 at 12 17 07 pm](https://user-images.githubusercontent.com/27624/53003638-7959f280-3440-11e9-99b8-1a372e0752fd.png)\r\n\r\n![screen_shot_2019-02-19_at_12_22_26_pm](https://user-images.githubusercontent.com/27624/53003944-29c7f680-3441-11e9-8c08-bb34383c1c1f.png)\r\n\r\n\r\nWhich is something the docs didn't mention, the only thing it has related to [swarm ports](https://docs.openfaas.com/deployment/docker-swarm/#12-join-any-workers-you-need), and I suggest that the docs say more information about the required ports for the system to work.\r\n\r\nSorry, @alexellis  if I was rude to you or anyone.\r\n\r\nHave a nice day."", 'Great to see that you figured it out 👍 The OpenFaaS docs link to the Swarm documentation that details the ports needed etc. Maybe this will help another user in the future. \r\n\r\nAlex', 'Derek lock: resolved']}"
1109,chunked response from function is blocked,https://github.com/openfaas/faas/issues/1109,"{'description': 'Dear maintainers,\r\n\r\nI created an issue to of-watchdog repository (https://github.com/openfaas-incubator/of-watchdog/issues/49).\r\nAnd I think openfaas itself also has similar issues.\r\n\r\n----\r\n\r\n\r\nI wrote my template that is similar to https://github.com/openfaas-incubator/python-flask-template/tree/master/template/python3-flask.\r\n\r\nThe different from the original is that my template uses stream response (or, chunked response) as follows.\r\n\r\n```py\r\n@app.route(""/"", defaults={""path"": """"}, methods=[""POST"", ""GET""])\r\n@app.route(""/<path:path>"", methods=[""POST"", ""GET""])\r\ndef main_route(path):\r\n    ...\r\n    def gen():\r\n        yield ""1""\r\n        time.sleep(1)\r\n        yield ""2""\r\n        time.sleep(1)\r\n        yield ""3""\r\n\r\n    return Response(gen())\r\n```\r\n\r\nWhen I invoke a function from the template, the function does not return response chunk by chunk.\r\nIt blocks 3 seconds, and then, returns whole the response (1, 2 and 3) all at once.\r\n\r\n## Expected Behaviour\r\nFunction returns response chunk by chunk.\r\n\r\n## Current Behaviour\r\nFunction blocks 3 seconds, and then, returns whole the response all at once.\r\n\r\n## Possible Solution\r\nThe following code may block until whole the response returned.\r\n\r\nhttps://github.com/openfaas/faas/blob/04d240aac26acdaf49863dbab768b4f5cb311d84/gateway/handlers/forwarding_proxy.go#L130\r\n\r\nAnd I found a hint to solve this issue in httputil package\'s ReverseProxy.copyBuffer method.\r\n\r\nhttps://golang.org/src/net/http/httputil/reverseproxy.go#L335\r\n\r\ncopyBuffer method reads response little by little and writes to maxLatencyWriter\r\n\r\nhttps://golang.org/src/net/http/httputil/reverseproxy.go#L366\r\n\r\nand maxLatencyWriter flushes periodically.\r\n\r\nhttps://golang.org/src/net/http/httputil/reverseproxy.go#L418\r\n\r\n## Steps to Reproduce (for bugs)\r\n1. fetch this template https://github.com/openfaas-incubator/python-flask-template/tree/master/template/python3-flask\r\n2. edit the template as described above\r\n3. create new function from the template\r\n4. build, push, deploy and invoke the function\r\n\r\n## Your Environment\r\nDocker version 18.09.1, build 4c52b90\r\nDocker swarm\r\nLinux (vagrant, vm.box = ""bento/centos-7.4"")\r\n\r\nThank you.', 'comments': [""Hi,\r\n\r\nThanks for your interest in OpenFaaS.\r\n\r\nI see that returning chunked-encoding is actually supported and not blocked, it just gets buffered before being returned to you.\r\n\r\n> Function blocks 3 seconds, and then, returns whole the response all at once.\r\n\r\nIn this example your client should be blocked for two seconds, not 3 given you have `sleep(1)` only twice.\r\n\r\nThe example given is a contrived example. Can you explain your business use-case which specifically needs a chunked-encoding to stream to the caller? Just to be up-front about this, it's unlikely to change, but I'd be curious to know more.\r\n\r\nIf you have long-running functions my advice would be to use the asynchronous processing in OpenFaaS. \r\n\r\nhttps://docs.openfaas.com/deployment/troubleshooting/#asynchronous-functions\r\n\r\nI'll close the issue, but please keep commenting.\r\n\r\nAlex""]}"
1110,node hmac validation,https://github.com/openfaas/faas/issues/1110,"{'description': 'Hey everyone!\r\n\r\nI just wrote a tiny library to do the Hmac checking for the functions using Node.JS (The examples that I found use Python) and included some (hopefully) useful documentation for future reference\r\n\r\nFeel free to use it and change it as you want!\r\nhttps://github.com/cabrerabywaters/faas-node-gatekeeper', 'comments': [""That's really cool. Could you submit it to the community.md file in the projects section?\r\n\r\nAre you connected on Slack yet too? https://docs.openfaas.com/community\r\n\r\nThanks,\r\n\r\nAlex"", '@alexellis \r\nSure will do it right away\r\nNot yet on slack, will go do it now ;) Thanks']}"
